{
  "attestations": [
    {
      "attestation_id": "attest_arjun_provenance_001",
      "claim_type": "self_asserted",
      "creator_id": "arjun",
      "evidence_hash": "d4b72a6cf1c1a5abf2dc38acee699d8c854037252d6adfb49d66067a21b3e6bf",
      "evidence_uri": "registered://attestations/arjun-provenance-ledger",
      "issued_at": "2026-05-29T00:00:00Z",
      "issuer": "rdllm-demo-registry",
      "signature": "demo-signature",
      "status": "active",
      "work_id": "arjun-provenance-ledger"
    },
    {
      "attestation_id": "attest_copycat_provenance_001",
      "claim_type": "self_asserted",
      "creator_id": "copycat",
      "evidence_hash": "4f57c40ce768743ab9efbdb3e4f8d6b8f0cb6945d1bc64f5af7ca0c14646fc1a",
      "evidence_uri": "registered://attestations/copycat-provenance-ledger",
      "issued_at": "2026-05-29T00:00:00Z",
      "issuer": "rdllm-demo-registry",
      "signature": "demo-signature",
      "status": "active",
      "work_id": "copycat-provenance-ledger"
    }
  ],
  "conflicts": [
    {
      "conflict_id": "conf_451172c810c96d60",
      "conflict_type": "duplicate_content",
      "content_hashes": [
        "e94efa6d9bb390d4771529cf4333dcb0acb75db9f9d65e0162832223f2b8a45f",
        "e94efa6d9bb390d4771529cf4333dcb0acb75db9f9d65e0162832223f2b8a45f"
      ],
      "creator_ids": [
        "arjun",
        "copycat"
      ],
      "resolution": "",
      "score": 1.0,
      "status": "open",
      "work_ids": [
        "arjun-provenance-ledger",
        "copycat-provenance-ledger"
      ]
    }
  ],
  "registry_report_version": "rdllm-claim-registry/v1",
  "report_hash": "3c48010352ebea9fa4c501a225d7292696fc25ce259c276681e5ab6a8039527d",
  "summary": {
    "attestation_count": 2,
    "conflicted_work_count": 2,
    "duplicate_threshold": 0.92,
    "open_conflict_count": 1,
    "work_count": 2
  }
}